{
  "schema_version": "signal.analysis/v4",
  "meta": {
    "program": "signal",
    "version": "0.1.0",
    "deterministic": true,
    "input": {
      "file_name": "synthetic.ab1",
      "sha256": "0123456789abcdef0123456789abcdef0123456789abcdef0123456789abcdef"
    },
    "reference": {
      "name": "synthetic",
      "topology": "linear",
      "sequence_sha256": "123456789abcdef0123456789abcdef0123456789abcdef0123456789abcdef0"
    },
    "configuration_sha256": "23456789abcdef0123456789abcdef0123456789abcdef0123456789abcdef01",
    "methods": {
      "basecalling": "signal.peak_recall/v2",
      "signal_processing": "signal.windowed_snr/v1",
      "quality_control": "signal.apollo_relative_quality/v1",
      "trimming": "signal.apollo_end_trim/v1",
      "alignment": "signal.gotoh_semiglobal/v1",
      "variant_calling": "signal.primary_difference/v3"
    }
  },
  "sequence": {
    "primary": "ACGTG",
    "ambiguity": "ACGTG",
    "retained": "ACGTG",
    "trim": {
      "start": 0,
      "end": 5
    }
  },
  "signal": {
    "windows": [
      {
        "calls": {
          "start": 0,
          "end": 5
        },
        "samples": {
          "start": 0,
          "end": 20
        },
        "minimum_primary_snr": 12.5,
        "maximum_secondary_snr": 0.0,
        "candidate_noisy": false
      }
    ],
    "noisy_regions": []
  },
  "alignment": {
    "orientation": "forward",
    "score": 7,
    "metrics": {
      "exact_matches": 4,
      "mismatches": 1,
      "gap_opens": 0,
      "callable_columns": 5,
      "callable_identity": 0.8,
      "unresolved_query_bases": 0
    },
    "reference_segments": [
      {
        "start": 2,
        "end": 7
      }
    ],
    "wraps_origin": false,
    "operation_runs": "5M",
    "gapped_query": "ACGTG",
    "gapped_reference": "ACGAG"
  },
  "variants": [
    {
      "contig": "synthetic",
      "position": 6,
      "reference": "A",
      "alternate": "T",
      "kind": "SNV",
      "classification": "primary_sequence_difference",
      "normalization": "linear_left",
      "calls": [
        {
          "role": "supporting",
          "index": 3,
          "position": 6,
          "ploc": 14,
          "primary": "T",
          "ambiguity": "T",
          "peaks": {
            "A": {
              "height": 0,
              "position": 14,
              "source": "ploc_fallback"
            },
            "C": {
              "height": 0,
              "position": 14,
              "source": "ploc_fallback"
            },
            "G": {
              "height": 0,
              "position": 14,
              "source": "ploc_fallback"
            },
            "T": {
              "height": 1000,
              "position": 14,
              "source": "local_maximum"
            }
          },
          "quality": {
            "relative_score": 60,
            "penalty": 0,
            "phred_calibrated": false,
            "vendor_score": 40,
            "vendor_score_applies": true
          }
        }
      ]
    }
  ],
  "warnings": {
    "total": 0,
    "unresolved_primary_calls": 0,
    "multi_channel_unresolved_calls": 0,
    "vendor_disagreements": 0,
    "excluded_variant_candidates": 0,
    "reference_origin_wrap": false
  }
}
